Arrest Date,Arrest Location,Arrest Number,Felony/Misdemeanor,Gender,Offender First Name,Offender Last Name,Offense,Officer,PSA,Age
2016-12-11 00:39:49,"555 MASSACHUSETTS AVENUE NWWASHINGTON, DC 20001UNITED STATES",011642824,M,M,Brent,Weber,Simple Assault,Moreland,102,26
2016-12-11 10:20:12,"G STREET NW & 7TH STREET NWWASHINGTON, DC 20001UNITED STATES",011642862,M,M,K`DYN,WALLER,Theft Second Degree (all Other Larceny),BUSH,102,23
2016-12-11 03:05:54,"1200 NORTH CAPITOL STWASHINGTON, DC 20001UNITED STATES",011642838,F,M,Jayshawn,DOUGLAS,Threat To Kidnap Or Injure A Person,HOVSEPIAN,103,21
2016-12-11 13:42:52,"K STREET NWWASHINGTON, DC 20005UNITED STATES",531642867,M,M,Timothy,Yates,Possession Of Drug Paraphernalia,Perez,104,35
2016-12-11 17:37:39,"300 WASHINGTON AVE SWWASHINGTON, DC 20024UNITED STATES",521642884,M,F,SHARNELL,MONTGOMERY,Driving Under The Influence Of Alcohol Or Drugs,PELTA,105,41
2016-12-11 20:08:09,"1100-1199 BLOCK 11TH STREET SE, B/T POTOMAC AVENUE SE & M STREET SEWASHINGTON, DCUNITED STATES",011642895,M,M,Kevin,Dean,No Permit,Robinson,106,20
2016-12-11 17:45:21,"1844 INDEPENDENCE AVENUE SEWASHINGTON, DC 20003UNITED STATES",011642879,M,F,Desiree,Franklin,No Permit,PEREZ,108,36
2016-12-11 01:00:09,"1700-1799 BLOCK INDEPENDENCE AVENUE SE, B/T 17TH STREET SE & 18TH STREET SEWASHINGTON, DC 20003UNITED STATES",081642831,M,M,TAIWO,JOHNSON,Driving Under Influence-1st Off,Naples,108,24
2016-12-11 04:00:35,"1368 F STREET NEWASHINGTON, DC 20002UNITED STATES",081642853,M,M,Allen,Suggs,Driving Under Influence -2nd Off,Nugent,108,35
